"","Title","Best_Match","Similarity"
"241","Application of deep learning to camera trap data for ecologists in planning/engineering--Can captivity imagery train a model which generalises to the wild?","Can citizen science analysis of camera trap data be used to study reproduction? Lessons from Snapshot Serengeti program","0.215613382899628"
"242","Minimizing the Annotation Effort for Detecting Wildlife in Camera Trap Images with Active Learning","Estimating the intensity of use by interacting predators and prey using camera traps","0.241758241758242"
"243","Automatic Camera Trap Classification Using Wildlife-Specific Deep Learning in Nilgai Management","Automatic camera-based identification and 3-D reconstruction of electrode positions in electrocardiographic imaging","0.289855072463768"
"244","Train Fast While Reducing False Positives: Improving Animal Classification Performance Using Convolutional Neural Networks","Where should cameras look at soccer games: Improving smoothness using the overlapped hidden Markov model","0.1875"
"245","Desert bighorn sheep (Ovis canadensis) recognition from camera traps based on learned features","Deep Learning Object Detection Methods for Ecological Camera Trap Data","0.209876543209877"
"246","Iterative Human and Automated Identification of Wildlife Images","Camera Angle and Photographic Identification of Individual Striped Skunks","0.323529411764706"
"247","U-Infuse: Democratization of Customizable AI for Object Detection","U-Infuse: Democratization of Customizable Deep Learning for Object Detection","0.598540145985402"
"248","Automated Image Recognition for Wildlife Camera Traps: Making it Work for You","Effect of Lure on Detecting Mammals with Camera Traps","0.279069767441861"
"249","Sequence Information Channel Concatenation for Improving Camera Trap Image Burst Classification","Constrained Multiple Planar Reconstruction for Automatic Camera Calibration of Intelligent Vehicles","0.216494845360825"
"250","Synthetic examples improve generalization for rare classes","Automatically Stereoscopic Camera Control for 3D Animation Production","0.251968503937008"
"251","“How many images do I need?” Understanding how sample size per class affects deep learning model performance metrics for balanced designs in autonomous wildlife monitoring","Estimating Species Richness and Modelling Habitat Preferences of Tropical Forest Mammals from Camera Trap Data","0.142857142857143"
"252","Dynamic Programming Selection of Object Proposals for Sequence-Level Animal Species Classification in the Wild","Context-based camera selection from multiple video streams","0.204819277108434"
"253","Fast human-animal detection from highly cluttered camera-trap images using joint background modeling and deep learning classification","Capturing and Marking Raccoons for Individual Recognition in Camera Studies using Tail-fur Clipping and Dyes","0.151260504201681"
"254","Sorting camera trap images","Testing camera traps as a potential tool for detecting nest predation of birds in a tropical rainforest environment","0.226950354609929"
"255","Individual identification of wild giant pandas from camera trap photos – a systematic and hierarchical approach","Individual identification of wild giant pandas from camera trap photos - a systematic and hierarchical approach","0.65158371040724"
"256","Animal identification in low quality camera-trap images using very deep convolutional neural networks and confidence thresholds","Distribution patterns of wild felids (Carnivora: Felidae) in the dry tropics of Central-Western Mexico","0.169642857142857"
"257","Efficient pipeline for camera trap image review","Automatic display of remote camera image","0.275862068965517"
